{
  "$schema": "https://json-schema.org/draft/2020-12/schema",
  "$id": "https://archmaker.dev/schemas/draft.schema.json",
  "title": "ArchMaker Draft (DM-DRAFT, v0)",
  "description": "Editable user intent: references to catalog definitions plus SelectionValue entries. Contains manual intent and references only, never derived state. The revision is a monotonic ETag-like token; contentDigest is the semantic digest of the canonical payload once known. Contract state: v0.",
  "$comment": "Contract v0 (phase R6, AUD-012). Shared $defs live in common.schema.json. Unknown fields rejected. saveDraft requires expectedRevision.",
  "type": "object",
  "additionalProperties": false,
  "required": [
    "id",
    "documentVersion",
    "schemaVersion",
    "revision",
    "catalogRef",
    "targetRef",
    "selections"
  ],
  "properties": {
    "id": {
      "description": "Draft identity (UUID).",
      "$ref": "https://archmaker.dev/schemas/common.schema.json#/$defs/uuid"
    },
    "documentVersion": {
      "$ref": "https://archmaker.dev/schemas/common.schema.json#/$defs/documentVersion"
    },
    "schemaVersion": {
      "description": "Draft contract axis. Only \"1\" and \"2\" are accepted; future values are rejected by Rust (ADR-0016).",
      "type": "string",
      "enum": ["1", "2"]
    },
    "revision": {
      "description": "Monotonic revision. Starts at 0 and increments on each successful saveDraft; used as the optimistic-concurrency token.",
      "$ref": "https://archmaker.dev/schemas/common.schema.json#/$defs/revision"
    },
    "contentDigest": {
      "description": "Semantic content digest of the canonical draft payload (ADR-0007). Optional: absent until the draft has been sealed/saved at least once. Serves as the content ETag alongside revision.",
      "$ref": "https://archmaker.dev/schemas/common.schema.json#/$defs/contentDigest"
    },
    "catalogRef": {
      "description": "Catalog the draft is resolved against.",
      "$ref": "https://archmaker.dev/schemas/common.schema.json#/$defs/catalogRef"
    },
    "targetRef": {
      "description": "Export target the draft is intended for.",
      "$ref": "https://archmaker.dev/schemas/common.schema.json#/$defs/targetRef"
    },
    "selections": {
      "description": "Manual intent selections. Derived selections are not stored here. Each entry carries the value only in value (no duplicated optionId).",
      "type": "array",
      "maxItems": 4096,
      "items": {
        "$ref": "https://archmaker.dev/schemas/common.schema.json#/$defs/selection"
      }
    },
    "presetRefs": {
      "description": "Presets applied to this draft. Derived selections are recomputed by the resolver.",
      "type": "array",
      "maxItems": 256,
      "uniqueItems": true,
      "items": {
        "$ref": "https://archmaker.dev/schemas/common.schema.json#/$defs/presetRef"
      }
    },
    "createdAt": {
      "description": "Ephemeral creation timestamp; excluded from the canonical hash payload.",
      "$ref": "https://archmaker.dev/schemas/common.schema.json#/$defs/utcTimestamp"
    },
    "updatedAt": {
      "description": "Ephemeral last-update timestamp; excluded from the canonical hash payload.",
      "$ref": "https://archmaker.dev/schemas/common.schema.json#/$defs/utcTimestamp"
    },
    "storagePlan": {
      "$ref": "https://archmaker.dev/schemas/draft-v2-defs.schema.json#/$defs/storagePlan"
    },
    "encryptionPolicy": {
      "$ref": "https://archmaker.dev/schemas/draft-v2-defs.schema.json#/$defs/encryptionPolicy"
    },
    "browserPolicy": {
      "$ref": "https://archmaker.dev/schemas/draft-v2-defs.schema.json#/$defs/browserPolicy"
    },
    "verification": {
      "$ref": "https://archmaker.dev/schemas/draft-v2-defs.schema.json#/$defs/verificationStatuses"
    },
    "inheritedEncryptIntent": {
      "description": "Historical v1 boolean encrypt intent preserved by migration; not LUKS2 policy.",
      "type": "boolean"
    }
  },
  "allOf": [
    {
      "if": {
        "properties": { "schemaVersion": { "const": "1" } },
        "required": ["schemaVersion"]
      },
      "then": {
        "not": {
          "anyOf": [
            { "required": ["storagePlan"] },
            { "required": ["encryptionPolicy"] },
            { "required": ["browserPolicy"] },
            { "required": ["verification"] },
            { "required": ["inheritedEncryptIntent"] }
          ]
        }
      }
    }
  ],
  "$defs": {
    "saveDraftRequest": {
      "description": "saveDraft request contract: persists a draft only if the stored revision matches expectedRevision (optimistic concurrency). A mismatch is a conflict error, not a silent overwrite.",
      "type": "object",
      "additionalProperties": false,
      "required": ["draft", "expectedRevision"],
      "properties": {
        "draft": {
          "description": "Draft to persist. Its revision is the new revision to store.",
          "$ref": "#"
        },
        "expectedRevision": {
          "description": "Revision the caller observed; the save is rejected if the stored revision differs.",
          "$ref": "https://archmaker.dev/schemas/common.schema.json#/$defs/revision"
        },
        "requestId": {
          "description": "Optional correlation id for the operation.",
          "$ref": "https://archmaker.dev/schemas/common.schema.json#/$defs/uuid"
        }
      }
    }
  }
}
